{
  "run_label": "good-fixture",
  "ambiguity_register": [
    {
      "id": 1,
      "ambiguity": "which schema toolchain is available",
      "materiality": "material",
      "resolved": true,
      "resolution": "require python3 (stdlib-only, no Node.js)",
      "resolution_source": "human-gate"
    },
    {
      "id": 2,
      "ambiguity": "TLA+ vs FSM table",
      "materiality": "minor",
      "resolved": true,
      "resolution": "FSM table is the model of record",
      "resolution_source": "human-gate"
    }
  ],
  "scope": {
    "in_scope": [
      "schemas",
      "validator",
      "fsm spec"
    ],
    "out_of_scope": [
      "editing the live skill"
    ]
  },
  "open_items": [],
  "definition_of_done": [
    "validate_run.py exits 0 on this run directory (RESULT: PASS)",
    "the schema self-check (--self-check) passes"
  ],
  "non_goals": [
    "do NOT edit the live dag skill",
    "do NOT add NLP/semantic heuristics or new runtime dependencies to the validator"
  ],
  "dimension_sweep": {
    "dimensions": [
      {
        "dimension": "terms",
        "disposition": "probed-clear",
        "search_statement": "sought load-bearing terms; each pinned by the prompt's own wording"
      },
      {
        "dimension": "success-criteria",
        "disposition": "none-after-genuine-search",
        "search_statement": "hunted for acceptance bars beyond the stated DoD; none found"
      },
      {
        "dimension": "scope-boundaries",
        "disposition": "probed-clear",
        "search_statement": "walked the OUT list edges; excluded areas are explicit"
      },
      {
        "dimension": "audience-format",
        "disposition": "none-after-genuine-search",
        "search_statement": "looked for output-shape doubt; the schema fixes it"
      },
      {
        "dimension": "constraints",
        "disposition": "probed-clear",
        "search_statement": "weighed the offline-only and no-live-guard rules; both explicit"
      },
      {
        "dimension": "assumptions",
        "disposition": "none-after-genuine-search",
        "search_statement": "named the tool commitments taken for granted; confirmed present"
      },
      {
        "dimension": "failure-modes",
        "disposition": "probed-clear",
        "search_statement": "enumerated deadlock and version-skew hazards; each addressed"
      },
      {
        "dimension": "sources",
        "disposition": "none-after-genuine-search",
        "search_statement": "checked which tiers are load-bearing; no new cartography needed"
      },
      {
        "dimension": "stakes",
        "disposition": "probed-clear",
        "search_statement": "sized the blast radius of the edit; git history makes it reversible"
      }
    ],
    "cartography_round": {
      "status": "no-register-unknowns"
    }
  }
}
